{
  "id": "item.sword.wood",
  "displayNameKey": "item.sword.wood.name",
  "descriptionKey": "item.sword.wood.desc",
  "slot": "weapon",
  "rarity": "common",
  "modelId": "models/items/wood-sword.glb",
  "weaponType": "sword",
  "modifiers": [
    { "stat": "atk", "kind": "flat", "value": 4 }
  ],
  "requiredLevel": 1
}
